Corpus	Id_aa	Nom_aa	Id_phrase	Texte_phrase	Id_SitEmo	Auteur_SitEmo	Texte_SitEmo	Nature_SitEmo	Declencheur_entier	Mode	Type1	Type2	Cat1	Cat2	Lemmes_declencheurs	Lemmes_SitEmo	exclamation	exclamation_phrase	interrogation	interrogation_phrase	pos_phrase	phrase_averbaux	interjections
FictionProjetM2	17006-4379562	Morgenstern_Flavia	17006-4379562_8992-9064	– Plus personne ne veut jouer avec moi dans la cour ! s’emporte Flavia. 	mantoine_1618562237762_17006-4379562	mantoine	Plus personne ne veut jouer avec moi dans la cour	Proposition	Plus personne ; jouer avec moi ; !	Montree	Base	Base	Tristesse	Colere	plus personne ; jouer avec moi ; !	plus personne ne vouloir jouer avec moi dans le cour	0	1	0	0	['PUNCT', 'ADV', 'PRON', 'ADV', 'VERB', 'VERB', 'ADP', 'PRON', 'ADP', 'DET', 'NOUN', 'PUNCT', 'PRON', 'VERB', 'PROPN', 'PUNCT']	0	0
FictionProjetM2	17006-4379562	Morgenstern_Flavia	17006-4379562_9064-9117	Même quand je réussis quelque chose, on me déteste ! 	mantoine_1621099111613_17006-4379562	mantoine	on me déteste	Proposition	on me déteste	Montree	Base	Base	Tristesse	Colere	on me détester	on me détester	0	1	0	0	['ADV', 'SCONJ', 'PRON', 'VERB', 'DET', 'NOUN', 'PUNCT', 'PRON', 'PRON', 'VERB', 'PUNCT']	0	0
FictionProjetM2	17006-4379562	Morgenstern_Flavia	17006-4379562_9117-9133	C’est pas juste.	mantoine_1618562232748_17006-4379562	mantoine	C’est pas juste	Proposition	C'est pas juste	Montree	Base	Base	Colere	Tristesse	ce être pas juste	c’ être pas juste	0	0	0	0	['PRON', 'AUX', 'ADV', 'ADV', 'PUNCT']	0	0
FictionProjetM2	17006-4379562	Morgenstern_Flavia	17006-4379562_9155-9178	– Quoi ? grogne Flavia.	mantoine_1618562376635_17006-4379562	mantoine	grogne	Proposition	grogne	Montree	Base	Aucun	Colere	Aucune	grogn	grogn	0	0	0	1	['PUNCT', 'INTJ', 'PUNCT', 'NOUN', 'PROPN', 'PUNCT']	0	1
FictionProjetM2	17006-4379562	Morgenstern_Flavia	17006-4379562_9471-9487	– Je pa… quoi ? 	mantoine_1621099279393_17006-4379562	mantoine	Je pa… quoi ?	Proposition	pa... quoi ?	Montree	Base	Aucun	Surprise	Aucune	pa ... quoi ?	je pa … quoi ?	0	0	1	1	['PUNCT', 'PRON', 'VERB', 'PUNCT', 'INTJ', 'PUNCT']	0	1
FictionProjetM2	17006-4379562	Morgenstern_Flavia	17006-4379562_9487-9539	Je les ai gagnées honnêtement : je n’ai pas triché !	mantoine_1618562603060_17006-4379562	mantoine	n’ai pas triché	Proposition	n'ai pas triché !	Montree	Base	Aucun	Colere	Aucune	ne avoir pas tricher !	n’ avoir pas tricher	0	1	0	0	['PRON', 'PRON', 'AUX', 'VERB', 'ADV', 'PUNCT', 'PRON', 'ADV', 'AUX', 'ADV', 'VERB', 'PUNCT']	0	0
FictionProjetM2	17006-4379562	Morgenstern_Flavia	17006-4379562_9752-9852	Tu veux que je dise : « Vous êtes des incompétents mais vous avez bien joué quand même », c’est ça ?	mantoine_1621277334233_17006-4379562	mantoine	c’est ça ?	Proposition	c'est ça ?	Montree	Base	Aucun	Colere	Aucune	ce être cela ?	c’ être cela ?	0	0	1	1	['PRON', 'VERB', 'SCONJ', 'PRON', 'VERB', 'PUNCT', 'PUNCT', 'PRON', 'AUX', 'DET', 'NOUN', 'CCONJ', 'PRON', 'AUX', 'ADV', 'VERB', 'SCONJ', 'ADV', 'PUNCT', 'PUNCT', 'PRON', 'AUX', 'PRON', 'PUNCT']	0	0
FictionProjetM2	17006-4379562	Morgenstern_Flavia	17006-4379562_9968-10104	Tu te plains toujours que tu n’arrives pas à te faire des amis, mais ce n’est pas étonnant si tu es toujours comme ça ! l’enfonce Anna. 	mantoine_1621278408099_17006-4379562	mantoine	ce n’est pas étonnant	Proposition	pas étonnant	Montree	Base	Aucun	Colere	Aucune	pas étonnant	ce n’ être pas étonnant	0	1	0	0	['PRON', 'PRON', 'VERB', 'ADV', 'SCONJ', 'PRON', 'ADV', 'VERB', 'ADV', 'ADP', 'PRON', 'VERB', 'ADP', 'DET', 'NOUN', 'PUNCT', 'CCONJ', 'PRON', 'ADV', 'AUX', 'ADV', 'ADJ', 'SCONJ', 'PRON', 'AUX', 'ADV', 'ADP', 'PRON', 'PUNCT', 'PRON', 'VERB', 'PROPN', 'PUNCT']	0	0
FictionProjetM2	17006-4379562	Morgenstern_Flavia	17006-4379562_10488-10527	– Laissez-moi tranquille ! râle Flavia.	mantoine_1618562922789_17006-4379562	mantoine	Laissez-moi tranquille	Proposition	Laissez-moi tranquille !	Montree	Base	Aucun	Colere	Aucune	Laissez moi tranquille !	Laissez moi tranquille	0	1	0	0	['PUNCT', 'INTJ', 'ADJ', 'PUNCT', 'INTJ', 'PROPN', 'PUNCT']	0	1
FictionProjetM2	17006-4379562	Morgenstern_Flavia	17006-4379562_10552-10630	On m’a dit que tu étais une vraie reine des billes : j’aimerais bien voir ça !	mantoine_1621279606081_17006-4379562	mantoine	j’aimerais bien voir ça	Proposition	j'aimerais bien	Montree	Complexe	Base	Fierte	Joie	je aimer bien	j’ aimer bien voir cela	0	1	0	0	['PRON', 'PRON', 'AUX', 'VERB', 'SCONJ', 'PRON', 'AUX', 'DET', 'ADJ', 'NOUN', 'ADP', 'DET', 'NOUN', 'PUNCT', 'PRON', 'VERB', 'ADV', 'VERB', 'PRON', 'PUNCT']	0	0
FictionProjetM2	17006-4379562	Morgenstern_Flavia	17006-4379562_10770-10804	Je suis un sacré joueur, tu sais ?	mantoine_1618563095415_17006-4379562	mantoine	Je suis un sacré joueur, tu sais ?	Proposition	tu sais ?	Montree	Complexe	Base	Fierte	Joie	tu sai ?	je être un sacrer joueur , tu sai ?	0	0	1	1	['PRON', 'AUX', 'DET', 'ADJ', 'NOUN', 'PUNCT', 'PRON', 'VERB', 'PUNCT']	0	0
FictionProjetM2	17006-4379562	Morgenstern_Flavia	17006-4379562_11525-11593	– J’aurais peut-être dû la laisser gagner, regrette Grand-Père Mimi.	mantoine_1621281037965_17006-4379562	mantoine	J’aurais peut-être dû la laisser gagner	Proposition	j'aurais peut-être dû	Montree	Complexe	Aucun	Culpabilite	Aucune	je avoir peut-être devoir	j’ avoir peut-être devoir le laisser gagner	0	0	0	0	['PUNCT', 'PRON', 'AUX', 'ADV', 'VERB', 'PRON', 'VERB', 'VERB', 'PUNCT', 'VERB', 'NOUN', 'PROPN', 'PUNCT']	0	0
FictionProjetM2	17006-4379562	Morgenstern_Flavia	17006-4379562_14768-14825	– Tu ne vas pas te laisser avoir par cette bébête de CP !	mantoine_1621101528293_17006-4379562	mantoine	Tu ne vas pas te laisser avoir par cette bébête de CP !	Proposition	te laisser avoir ; cette bêbête de CP	Montree	Complexe	Base	Fierte	Colere	te laisser avoir ; ce bêbête de cp	tu ne aller pas te laisser avoir par ce bébête de cp !	1	1	0	0	['PUNCT', 'PRON', 'ADV', 'VERB', 'ADV', 'PRON', 'VERB', 'VERB', 'ADP', 'DET', 'NOUN', 'ADP', 'PROPN', 'PUNCT']	0	0
FictionProjetM2	17006-4379562	Morgenstern_Flavia	17006-4379562_15886-15903	– Oui, bien sûr !	mantoine_1621286550677_17006-4379562	mantoine	Oui, bien sûr	Proposition	bien sûr	Montree	Base	Aucun	Joie	Aucune	bien sûr	Oui , bien sûr	0	1	0	0	['PUNCT', 'INTJ', 'PUNCT', 'ADV', 'ADJ', 'PUNCT']	0	1
FictionProjetM2	25339-0	Morgenstern_mariage_modifAline	25339-0_311-351	C’est tellement rare que c’est la fête !	alessieux_1621740287035_25339-0	alessieux	c’est la fête	Proposition	c'est la fête	Montree	Base	Aucun	Joie	Aucune	ce être le fête	c’ être le fête	0	1	0	0	['PRON', 'AUX', 'ADV', 'ADJ', 'SCONJ', 'PRON', 'AUX', 'DET', 'NOUN', 'PUNCT']	0	0
FictionProjetM2	25339-0	Morgenstern_mariage_modifAline	25339-0_844-893	– Grrr, c’est toujours pareil ! grommèle Flavia. 	alessieux_1621740667093_25339-0	alessieux	c’est toujours pareil	Proposition	c'est toujours pareil	Montree	Base	Aucun	Colere	Aucune	ce être toujours pareil	c’ être toujours pareil	0	1	0	0	['PUNCT', 'INTJ', 'PUNCT', 'PRON', 'AUX', 'ADV', 'ADJ', 'PUNCT', 'INTJ', 'PROPN', 'PUNCT']	0	1
FictionProjetM2	25339-0	Morgenstern_mariage_modifAline	25339-0_893-933	Il n’y a jamais personne pour m’écouter.	alessieux_1621740738953_25339-0	alessieux	Il n’y a jamais personne pour m’écouter	Proposition	jamais personne pour m'écouter	Montree	Base	Aucun	Colere	Aucune	jamais personn pour me écouter	il n’ y avoir jamais personn pour m’ écouter	0	0	0	0	['PRON', 'ADV', 'PRON', 'VERB', 'ADV', 'PRON', 'ADP', 'PRON', 'VERB', 'PUNCT']	0	0
FictionProjetM2	25339-0	Morgenstern_mariage_modifAline	25339-0_1114-1166	– Vous avez quelque chose à fêter ? s’étonne Ariane.	alessieux_1621766035256_25339-0	alessieux	Vous avez quelque chose à fêter ?	Proposition	Vous avez quelque chose à fêter ?	Montree	Base	Aucun	Surprise	Aucune	vous avoir quelque chose à fêter ?	vous avoir quelque chose à fêter ?	0	0	1	1	['PUNCT', 'PRON', 'VERB', 'DET', 'NOUN', 'ADP', 'VERB', 'PUNCT', 'PRON', 'VERB', 'PROPN', 'PUNCT']	0	0
FictionProjetM2	25339-0	Morgenstern_mariage_modifAline	25339-0_2038-2080	– Va savoir où je serai, ronchonne Ariane.	alessieux_1621742109071_25339-0	alessieux	Va savoir	Proposition	Va savoir	Montree	Base	Aucun	Colere	Aucune	aller savoir	aller savoir	0	0	0	0	['PUNCT', 'VERB', 'VERB', 'PRON', 'PRON', 'AUX', 'PUNCT', 'VERB', 'PROPN', 'PUNCT']	0	0
FictionProjetM2	25339-0	Morgenstern_mariage_modifAline	25339-0_2186-2245	Ce n’est pas tous les jours que tes parents se remarient ! 	alessieux_1621767632439_25339-0	alessieux	Ce n’est pas tous les jours que	Proposition	Ce n'est pas tous les jours que	Montree	Base	Aucun	Colere	Aucune	ce ne être pas tout le jour que	ce n’ être pas tout le jour que	0	1	0	0	['PRON', 'ADV', 'AUX', 'ADV', 'ADJ', 'DET', 'NOUN', 'SCONJ', 'DET', 'NOUN', 'PRON', 'VERB', 'PUNCT']	0	0
FictionProjetM2	25339-0	Morgenstern_mariage_modifAline	25339-0_3592-3610	C’est une blague ?	alessieux_1621769235524_25339-0	alessieux	C’est une blague ?	Proposition	c'est une blague ?	Montree	Base	Aucun	Surprise	Aucune	ce être un blague ?	c’ être un blague ?	0	0	1	1	['PRON', 'AUX', 'DET', 'NOUN', 'PUNCT']	0	0
FictionProjetM2	25339-0	Morgenstern_mariage_modifAline	25339-0_5243-5258	C’est parfait !	alessieux_1621747786185_25339-0	alessieux	C’est parfait	Proposition	c'est parfait	Montree	Base	Aucun	Joie	Aucune	ce être parfaire	c’ être parfaire	0	1	0	0	['PRON', 'AUX', 'ADJ', 'PUNCT']	0	0
FictionProjetM2	25339-0	Morgenstern_mariage_modifAline	25339-0_7791-7867	C’est décidé, les stars de la pièce de Cara seront les animaux de la ferme! 	alessieux_1621753316823_25339-0	alessieux	C’est décidé	Proposition	C'est décidé	Montree	Base	Aucun	Joie	Aucune	ce être décider	c’ être décider	0	1	0	0	['PRON', 'AUX', 'VERB', 'PUNCT', 'DET', 'NOUN', 'ADP', 'DET', 'NOUN', 'ADP', 'PROPN', 'AUX', 'DET', 'NOUN', 'ADP', 'DET', 'NOUN', 'PUNCT']	0	0
FictionProjetM2	25339-0	Morgenstern_mariage_modifAline	25339-0_11402-11429	– C’était ? s’étonne Elisa.	alessieux_1621782153320_25339-0	alessieux	C’était ?	Proposition	C'était ?	Montree	Base	Aucun	Surprise	Aucune	ce être ?	c’ être ?	0	0	1	1	['PUNCT', 'PRON', 'AUX', 'PUNCT', 'PRON', 'VERB', 'PROPN', 'PUNCT']	0	0
FictionProjetM2	25339-0	Morgenstern_mariage_modifAline	25339-0_11429-11448	– Tout est annulé. 	alessieux_1621782207525_25339-0	alessieux	Tout est annulé	Proposition	Tout est annulé	Montree	Base	Aucun	Tristesse	Aucune	tout être annuler	tout être annuler	0	0	0	0	['PUNCT', 'PRON', 'AUX', 'VERB', 'PUNCT']	0	0
FictionProjetM2	25339-0	Morgenstern_mariage_modifAline	25339-0_13856-13886	– Ça tombe bien, rigole Mimi. 	alessieux_1622408682773_25339-0	alessieux	Ça tombe bien	Proposition	ça tombe bien	Montree	Base	Aucun	Joie	Aucune	cela tombe bien	cela tombe bien	0	0	0	0	['PUNCT', 'PRON', 'VERB', 'ADV', 'PUNCT', 'VERB', 'PROPN', 'PUNCT']	0	0
FictionProjetM2	25339-0	Morgenstern_mariage_modifAline	25339-0_14433-14509	– Ça ne me dit toujours pas à quoi ça sert, de se marier ! ronchonne Flavia.	alessieux_1622408929826_25339-0	alessieux	Ça ne me dit toujours pas	Proposition	ça ne me dit toujours pas	Montree	Base	Aucun	Colere	Aucune	cela ne me dire toujours pas	cela ne me dire toujours pas	0	1	0	0	['PUNCT', 'PRON', 'ADV', 'PRON', 'VERB', 'ADV', 'ADV', 'ADP', 'PRON', 'PRON', 'VERB', 'PUNCT', 'ADP', 'PRON', 'VERB', 'PUNCT', 'NOUN', 'PROPN', 'PUNCT']	0	0
FictionProjetM2	25339-0	Morgenstern_mariage_modifAline	25339-0_15861-15943	– En Suisse ou à Tombouctou: qu’on en finisse et qu’ils vivent heureux! répond-il.	alessieux_1623215431592_25339-0	alessieux	qu’on en finisse	Proposition	qu'on en finisse	Montree	Base	Aucun	Colere	Aucune	que on en finir	qu’ on en finir	0	1	0	0	['PUNCT', 'ADP', 'PROPN', 'CCONJ', 'ADP', 'PROPN', 'SCONJ', 'PRON', 'PRON', 'VERB', 'CCONJ', 'SCONJ', 'PRON', 'VERB', 'ADJ', 'PUNCT', 'VERB', 'PUNCT']	0	0
FictionProjetM2	25339-0	Morgenstern_mariage_modifAline	25339-0_16210-16270	Grand-Mère Léo voulait un mariage insolite : c’est le cas ! 	alessieux_1623217318274_25339-0	alessieux	c’est le cas 	Proposition	c'est le cas	Montree	Base	Aucun	Joie	Aucune	ce être le cas	c’ être le cas	0	1	0	0	['NOUN', 'PROPN', 'VERB', 'DET', 'NOUN', 'ADJ', 'PUNCT', 'PRON', 'AUX', 'DET', 'NOUN', 'PUNCT']	0	0
FictionProjetM2	25339-0	Morgenstern_mariage_modifAline	25339-0_16893-16934	– Ma chérie… c’est cuit pour la Suisse ! 	alessieux_1623217986601_25339-0	alessieux	c’est cuit pour	Proposition	c'est cuit pour	Montree	Base	Aucun	Tristesse	Aucune	ce être cuire pour	c’ être cuire pour	0	1	0	0	['PUNCT', 'DET', 'NOUN', 'PUNCT', 'PRON', 'AUX', 'VERB', 'ADP', 'DET', 'PROPN', 'PUNCT']	0	0
FictionProjetM2	25339-0	Morgenstern_mariage_modifAline	25339-0_19223-19260	– C’est pour ça qu’elle t’a quitté ? 	alessieux_1623223500390_25339-0	alessieux	C’est pour ça qu’elle	Proposition	C'est pour ça qu'	Montree	Base	Aucun	Surprise	Aucune	ce être pour cela que '	c’ être pour cela qu’ lui	0	0	0	1	['PUNCT', 'PRON', 'AUX', 'ADP', 'PRON', 'SCONJ', 'PRON', 'PRON', 'AUX', 'VERB', 'PUNCT']	0	0
PtitLibe	2640-29197080	7-12_PtitLibe24-JO_Paris_Pourquoi_certains_contre	2640-29197080_2282-2436	«C’est bien gentil les paillettes, les jolies histoires, mais en réalité les JO c’est surtout une affaire de sponsors et d’argent,affirme Frédéric Viale. 	aetienne_1621579827725_2640-29197080	aetienne	C’est bien gentil	Proposition	C’est bien gentil	Montree	Base	Aucun	Colere	Aucune	c’ être bien gentil	c’ être bien gentil	0	0	0	0	['PUNCT', 'PRON', 'AUX', 'ADV', 'ADJ', 'DET', 'NOUN', 'PUNCT', 'DET', 'ADJ', 'NOUN', 'PUNCT', 'CCONJ', 'ADP', 'NOUN', 'DET', 'PROPN', 'PRON', 'AUX', 'ADV', 'DET', 'NOUN', 'ADP', 'NOUN', 'CCONJ', 'ADP', 'NOUN', 'PUNCT', 'VERB', 'PROPN', 'PROPN', 'PUNCT']	0	0
PtitLibe	2265-97810218	7-12_PtitLibe28-Weinstein_harcelement_sexuel_Lina_et_Meissane	2265-97810218_394-485	Maintenant, on voit du harcèlement tous les jours, dans la rue, dans le métro, au travail. 	aetienne_1628577532459_2265-97810218	aetienne	voit du harcèlement tous les jours, dans la rue, dans le métro, au travail	Proposition	harcèlement	Montree	Base	Aucun	Peur	Aucune	harcèlemer	voit de harcèlement tout le jour , dans le rue , dans le métro , au travail	0	0	0	0	['ADV', 'PUNCT', 'PRON', 'VERB', 'ADP', 'DET', 'NOUN', 'ADJ', 'DET', 'NOUN', 'PUNCT', 'ADP', 'DET', 'NOUN', 'PUNCT', 'ADP', 'DET', 'NOUN', 'PUNCT', 'ADP', 'DET', 'NOUN', 'PUNCT']	0	0
PtitLibe	2470-94890510	7-12_PtitLibe36-conflit_Israel-Palestine_Tavor_Areen	2470-94890510_1884-1936	C’est pas juste parce que Trump, il ne vit pas ici. 	aetienne_1628759510283_2470-94890510	aetienne	C’est pas juste	Proposition	pas juste	Montree	Base	Aucun	Colere	Aucune	pas juste	c’ être pas juste	0	0	0	0	['PRON', 'AUX', 'ADV', 'ADV', 'ADV', 'SCONJ', 'PROPN', 'PUNCT', 'PRON', 'ADV', 'VERB', 'ADV', 'ADV', 'PUNCT']	0	0
PtitLibe	2082-41605839	7-12_PtitLibe65-Tour_France_Pourquoi_gros_evenement	2082-41605839_35-127	«Le Tour de France, c’est Noël en juillet», déclarait autrefois l’écrivain Antoine Blondin. 	aetienne_1629385142799_2082-41605839	aetienne	c’est Noël en juillet	Proposition	c’est Noël en juillet	Montree	Base	Aucun	Joie	Aucune	c’ être Noël en juillet	c’ être Noël en juillet	0	0	0	0	['PUNCT', 'DET', 'NOUN', 'ADP', 'PROPN', 'PUNCT', 'PRON', 'AUX', 'PROPN', 'ADP', 'NOUN', 'PUNCT', 'VERB', 'ADV', 'DET', 'NOUN', 'PROPN', 'PROPN', 'PUNCT']	0	0
PtitLibe	4423-38686131	7-12_PtitLibe80-P_tit_Libe_philosophes_Pourquoi_certaines_personnes_ont_pouvoir	4423-38686131_2049-2186	Dans ce cas, on se dit : «C’est pas juste !» Et ce qui est injuste, c’est que les personnes qui subissent un pouvoir n’en possèdent pas. 	aetienne_1629837972973_4423-38686131	aetienne	C’est pas juste	Proposition	pas juste	Montree	Base	Base	Colere	Tristesse	pas juste	c’ être pas juste	0	1	0	0	['ADP', 'DET', 'NOUN', 'PUNCT', 'PRON', 'PRON', 'VERB', 'PUNCT', 'PUNCT', 'PRON', 'AUX', 'ADV', 'ADV', 'PUNCT', 'PUNCT', 'CCONJ', 'PRON', 'PRON', 'AUX', 'ADJ', 'PUNCT', 'PRON', 'AUX', 'SCONJ', 'DET', 'NOUN', 'PRON', 'VERB', 'DET', 'NOUN', 'ADV', 'PRON', 'VERB', 'ADV', 'PUNCT']	0	0
PtitLibe	4423-38686131	7-12_PtitLibe80-P_tit_Libe_philosophes_Pourquoi_certaines_personnes_ont_pouvoir	4423-38686131_3754-3935	Même quand ils sont élus, les dirigeants doivent faire attention à ce que les gens (qu’on appelle les citoyens) ne se disent pas «c’est pas juste !» quand ils prennent une décision.	aetienne_1629838242613_4423-38686131	aetienne	c’est pas juste	Proposition	pas juste	Montree	Base	Base	Colere	Tristesse	pas juste	c’ être pas juste	0	1	0	0	['ADV', 'SCONJ', 'PRON', 'AUX', 'VERB', 'PUNCT', 'DET', 'NOUN', 'VERB', 'VERB', 'NOUN', 'ADP', 'PRON', 'SCONJ', 'DET', 'NOUN', 'PUNCT', 'PRON', 'PRON', 'VERB', 'DET', 'NOUN', 'PUNCT', 'ADV', 'PRON', 'VERB', 'ADV', 'PUNCT', 'PRON', 'AUX', 'ADV', 'ADJ', 'PUNCT', 'PUNCT', 'SCONJ', 'PRON', 'VERB', 'DET', 'NOUN', 'PUNCT']	0	0
PtitLibe	1911-53864613	7-12_PtitLibe95-antisemitisme_manifestations_contre_antisemitisme	1911-53864613_1097-1300	C’est 230 de plus que l’année d’avant. «Ça fait 20 ans que c’est comme ça, s’agace Alain Jakubowicz, avocat et ancien président de la Licra, la Ligue internationale contre le racisme et l’antisémitisme. 	aetienne_1630101777061_1911-53864613	aetienne	Ça fait 20 ans que c’est comme ça	Proposition	Ça fait 20 ans que c’est comme ça	Montree	Base	Aucun	Colere	Aucune	cela faire 20 an que c’ être comme cela	cela faire 20 an que c’ être comme cela	0	0	0	0	['PRON', 'AUX', 'NUM', 'ADP', 'ADV', 'SCONJ', 'DET', 'NOUN', 'ADP', 'ADV', 'PUNCT', 'PUNCT', 'PRON', 'VERB', 'NUM', 'NOUN', 'SCONJ', 'PRON', 'AUX', 'ADP', 'PRON', 'PUNCT', 'PRON', 'VERB', 'PROPN', 'PROPN', 'PUNCT', 'NOUN', 'CCONJ', 'ADJ', 'NOUN', 'ADP', 'DET', 'PROPN', 'PUNCT', 'DET', 'NOUN', 'ADJ', 'ADP', 'DET', 'NOUN', 'CCONJ', 'DET', 'NOUN', 'PUNCT']	0	0
WP7Encyclo	2323-93430656	encyclo_SP-Vikidia_Belle-Ile	2323-93430656_1609-1676	Avec Louis XIV, elle est réduite au simple rôle de place militaire.	aetienne_1620827604449_2323-93430656	aetienne	est réduite au simple rôle de	Proposition	réduite au simple rôle de	Montree	Base	Aucun	Tristesse	Aucune	réduire au simple rôle de	être réduire au simple rôle de	0	0	0	0	['ADP', 'PROPN', 'NUM', 'PUNCT', 'PRON', 'AUX', 'VERB', 'ADP', 'DET', 'ADJ', 'NOUN', 'ADP', 'NOUN', 'ADJ', 'PUNCT']	0	0
WP7Encyclo	2099-0	encyclo_Vikidia_Napoleon	2099-0_351-447	Il s'illustre alors par de brillantes et glorieuses campagnes militaires en Italie et en Égypte.	aetienne_1630273431765_2099-0	aetienne	s'illustre	Proposition	s'illustre	Montree	Complexe	Aucun	Admiration	Aucune	se illustre	se illustre	0	0	0	0	['PRON', 'PRON', 'VERB', 'ADV', 'ADP', 'DET', 'ADJ', 'CCONJ', 'ADJ', 'NOUN', 'ADJ', 'ADP', 'PROPN', 'CCONJ', 'ADP', 'PROPN', 'PUNCT']	0	0
WP7Fiction	2281-99270072	fiction_Alector_Dragonne-de-minuit_Laroche	2281-99270072_665-727	– Viens vite, Angus est brûlant de fièvre et ne peut se lever.	aetienne_1620827604950_2281-99270072	aetienne	Viens vite	Proposition	Viens vite	Montree	Base	Aucun	Peur	Aucune	Viens vite	Viens vite	0	0	0	0	['PUNCT', 'VERB', 'ADV', 'PUNCT', 'PROPN', 'AUX', 'ADJ', 'ADP', 'NOUN', 'CCONJ', 'ADV', 'VERB', 'PRON', 'VERB', 'PUNCT']	0	0
WP7Fiction	1688-7299270	fiction_Alector_Les-boites-de-peinture_Ayme	1688-7299270_1484-1546	« C'est bon, dit-il en s'éloignant, je n'ai que deux pattes. »	aetienne_1620827605083_1688-7299270	aetienne	C'est bon	Proposition	C'est bon	Montree	Base	Aucun	Tristesse	Aucune	ce être bon	ce être bon	0	0	0	0	['PUNCT', 'PRON', 'AUX', 'ADJ', 'PUNCT', 'VERB', 'PRON', 'ADP', 'PRON', 'VERB', 'PUNCT', 'PRON', 'ADV', 'VERB', 'ADV', 'NUM', 'NOUN', 'PUNCT', 'PUNCT']	0	0
