Corpus	Id_aa	Nom_aa	Id_phrase	Texte_phrase	Id_SitEmo	Auteur_SitEmo	Texte_SitEmo	Nature_SitEmo	Declencheur_entier	Mode	Type1	Type2	Cat1	Cat2	Lemmes_declencheurs	Lemmes_SitEmo	exclamation	exclamation_phrase	interrogation	interrogation_phrase	pos_phrase	phrase_averbaux	interjections
Albert	587-83561643	Albert11_Voleur_du_dimanche	587-83561643_19-206	On pourrait croire qu’il s’agit d’un film comique mais les images sont bien réelles : aux États-Unis, une caméra de sécurité d’un supermarché a filmé le voleur le plus maladroit du monde.	doltean_1621943477089_587-83561643	doltean	On pourrait croire qu’il s’agit d’un film comique	Proposition	On pourrait croire qu'il s'agit d'un film comique	Montree	Base	Aucun	Surprise	Aucune	on pouvoir croire que il se agir de un film comique	on pouvoir croire qu’ il s’ agir d’ un film comique	0	0	0	0	['PRON', 'VERB', 'VERB', 'SCONJ', 'PRON', 'PRON', 'VERB', 'ADP', 'DET', 'NOUN', 'ADJ', 'CCONJ', 'DET', 'NOUN', 'AUX', 'ADV', 'ADJ', 'PUNCT', 'ADP', 'DET', 'PROPN', 'PUNCT', 'DET', 'NOUN', 'ADP', 'NOUN', 'ADP', 'DET', 'NOUN', 'AUX', 'VERB', 'DET', 'NOUN', 'DET', 'ADV', 'ADJ', 'ADP', 'DET', 'NOUN', 'PUNCT']	0	0
Albert	2807-0	Albert15_Pluton_planete_mal-aimee_des_astronomes	2807-0_1841-2156	Toutefois, pour l’instant, leur proposition est loin de faire l’unanimité parmi les chercheurs. « Il faut être assez désespéré, si vous avez besoin de faire de la Lune une planète juste pour pouvoir dire que Pluton en est une », a rétorqué l’astronome Mike Brown, celui qui a retiré Pluton de la liste des planètes.	doltean_1616082724076_2807-0	doltean	Il faut être assez désespéré	Proposition	désespéré	Montree	Base	Aucun	Colere	Aucune	désespérer	il falloir être assez désespérer	0	0	0	0	['ADV', 'PUNCT', 'ADP', 'DET', 'NOUN', 'PUNCT', 'DET', 'NOUN', 'AUX', 'ADV', 'ADP', 'VERB', 'DET', 'NOUN', 'ADP', 'DET', 'NOUN', 'PUNCT', 'PUNCT', 'PRON', 'VERB', 'AUX', 'ADV', 'ADJ', 'PUNCT', 'SCONJ', 'PRON', 'VERB', 'NOUN', 'ADP', 'VERB', 'ADP', 'DET', 'NOUN', 'DET', 'NOUN', 'ADV', 'ADP', 'VERB', 'VERB', 'SCONJ', 'PROPN', 'PRON', 'AUX', 'PRON', 'PUNCT', 'PUNCT', 'AUX', 'VERB', 'DET', 'NOUN', 'PROPN', 'PROPN', 'PUNCT', 'PRON', 'PRON', 'AUX', 'VERB', 'PROPN', 'ADP', 'DET', 'NOUN', 'ADP', 'DET', 'NOUN', 'PUNCT']	0	0
Albert	5579-0	Albert16_Le_festival_de_Cannes_celebre_sa_70e_edition	5579-0_4215-4302	Il lui avait alors lancé : « si vous ne m’aimez pas, je ne vous aime pas non plus ! ». 	doltean_1615993152411_5579-0	doltean	si vous ne m’aimez pas, je ne vous aime pas non plus	Proposition	si vous ne m’aimez pas, je ne vous aime pas non plus !	Montree	Base	Aucun	Colere	Aucune	si vous ne m’ aimer pas , je ne vous aimer pas non plus !	si vous ne m’ aimer pas , je ne vous aimer pas non plus	0	1	0	0	['PRON', 'PRON', 'AUX', 'ADV', 'VERB', 'PUNCT', 'PUNCT', 'SCONJ', 'PRON', 'ADV', 'PRON', 'VERB', 'ADV', 'PUNCT', 'PRON', 'ADV', 'PRON', 'VERB', 'ADV', 'ADV', 'ADV', 'PUNCT', 'PUNCT', 'PUNCT']	0	0
Albert	5278-0	Albert18_Climat_l_Amerique_seule_contre_tous	5278-0_1565-1796	Le 1er juin, Donald Trump a annoncé son intention de sortir de cet accord de Paris car selon lui, ce texte est « injuste » envers les États-Unis et les oblige à faire de gros efforts, alors que la Chine pollue beaucoup plus qu’eux.	doltean_1619442189258_5278-0	doltean	injuste	Proposition	injuste	Montree	Base	Aucun	Colere	Aucune	injuste	injuste	0	0	0	0	['DET', 'NUM', 'NOUN', 'PUNCT', 'PROPN', 'PROPN', 'AUX', 'VERB', 'DET', 'NOUN', 'ADP', 'VERB', 'ADP', 'DET', 'NOUN', 'ADP', 'PROPN', 'CCONJ', 'ADP', 'PRON', 'PUNCT', 'DET', 'NOUN', 'AUX', 'PUNCT', 'ADJ', 'PUNCT', 'ADP', 'DET', 'PROPN', 'CCONJ', 'PRON', 'VERB', 'ADP', 'VERB', 'DET', 'ADJ', 'NOUN', 'PUNCT', 'ADV', 'SCONJ', 'DET', 'PROPN', 'VERB', 'ADV', 'ADV', 'SCONJ', 'PRON', 'PUNCT']	0	0
Albert	5278-0	Albert18_Climat_l_Amerique_seule_contre_tous	5278-0_3265-3351	Donald Trump estime qu’il est « injuste » qu’on lui demande de payer pour les autres. 	doltean_1616061182361_5278-0	doltean	injuste	Proposition	injuste	Montree	Base	Aucun	Colere	Aucune	injuste	injuste	0	0	0	0	['PROPN', 'PROPN', 'VERB', 'SCONJ', 'PRON', 'AUX', 'PUNCT', 'ADJ', 'PUNCT', 'SCONJ', 'PRON', 'PRON', 'VERB', 'ADP', 'VERB', 'ADP', 'DET', 'PRON', 'PUNCT']	0	0
Albert	3193-71532846	Albert2-science_dinosaures	3193-71532846_176-329	En plus du T-rex et du diplodocus, on trouve aussi le psittacosaurus, qui n’a rien des grands méchants dinosaures mis en scène dans la plupart des films.	doltean_1614852624882_3193-71532846	doltean	qui n’a rien des grands méchants dinosaures	Proposition	qui n'a rien des	Montree	Base	Aucun	Surprise	Aucune	qui ne avoir rien de	qui n’ avoir rien de grand méchant dinosaure	0	0	0	0	['ADP', 'ADV', 'ADP', 'DET', 'NOUN', 'CCONJ', 'ADP', 'DET', 'NOUN', 'PUNCT', 'PRON', 'VERB', 'ADV', 'DET', 'X', 'PUNCT', 'PRON', 'ADV', 'VERB', 'PRON', 'DET', 'ADJ', 'ADJ', 'NOUN', 'VERB', 'ADP', 'NOUN', 'ADP', 'DET', 'NOUN', 'ADP', 'DET', 'NOUN', 'PUNCT']	0	0
Albert	3193-71532846	Albert2-science_dinosaures	3193-71532846_919-988	Et il se trouve qu’il n’était pas aussi impressionnant que Godzilla !	doltean_1619182135908_3193-71532846	doltean	il se trouve qu	Proposition	il se trouve qu	Montree	Base	Aucun	Surprise	Aucune	il se trouver qu	il se trouver qu	0	1	0	0	['CCONJ', 'PRON', 'PRON', 'VERB', 'SCONJ', 'PRON', 'ADV', 'AUX', 'ADV', 'ADV', 'ADJ', 'SCONJ', 'PROPN', 'PUNCT']	0	0
Albert	3193-71532846	Albert2-science_dinosaures	3193-71532846_919-988	Et il se trouve qu’il n’était pas aussi impressionnant que Godzilla !	doltean_1620303442432_3193-71532846	doltean	pas aussi impressionnant que Godzilla	Proposition	pas aussi que	Montree	Base	Aucun	Surprise	Aucune	pas aussi que	pas aussi impressionner que Godzilla	0	1	0	0	['CCONJ', 'PRON', 'PRON', 'VERB', 'SCONJ', 'PRON', 'ADV', 'AUX', 'ADV', 'ADV', 'ADJ', 'SCONJ', 'PROPN', 'PUNCT']	0	0
Albert	5190-56934306	Albert2-succes_Jeux_paralympiques	5190-56934306_3677-3840	Par exemple, les athlètes de la catégorie « T13 », c’est-à-dire des sportifs malvoyants (mais pas totalement aveugles) ont explosé les records de vitesse sur le 1.	doltean_1619011627866_5190-56934306	doltean	explosé les records de vitesse sur le 1.500 mètres	Proposition	explosé	Montree	Complexe	Aucun	Admiration	Aucune	exploser	exploser le record de vitesse sur le 1.500 mètre	0	0	0	0	['ADP', 'NOUN', 'PUNCT', 'DET', 'NOUN', 'ADP', 'DET', 'NOUN', 'PUNCT', 'X', 'PUNCT', 'PUNCT', 'CCONJ', 'DET', 'NOUN', 'ADJ', 'PUNCT', 'CCONJ', 'ADV', 'ADV', 'ADJ', 'PUNCT', 'AUX', 'VERB', 'DET', 'NOUN', 'ADP', 'NOUN', 'ADP', 'DET', 'NUM']	0	0
Albert	426-16388361	Albert27-A3_Qui_dit_mieux	426-16388361_16-292	C’est un record qui a été pulvérisé le 16 novembre dernier lors d’une vente aux enchères à New-York : en seulement 19 minutes, l’œuvre de Léonard de Vinci intitulée « Salvator Mundi » a été adjugée à 450,3 millions de dollars, devenant ainsi le tableau le plus cher du monde. 	doltean_1620122114913_426-16388361	doltean	pulvérisé	Proposition	pulvérisé	Montree	Base	Aucun	Surprise	Aucune	pulvériser	pulvériser	0	0	0	0	['PRON', 'AUX', 'DET', 'NOUN', 'PRON', 'AUX', 'AUX', 'VERB', 'DET', 'NUM', 'NOUN', 'ADJ', 'ADV', 'ADP', 'DET', 'NOUN', 'ADP', 'DET', 'NOUN', 'ADP', 'PROPN', 'PUNCT', 'ADP', 'ADV', 'NUM', 'NOUN', 'PUNCT', 'DET', 'NOUN', 'ADP', 'PROPN', 'ADP', 'PROPN', 'VERB', 'PUNCT', 'PROPN', 'PROPN', 'PUNCT', 'AUX', 'AUX', 'VERB', 'ADP', 'NUM', 'NOUN', 'ADP', 'NOUN', 'PUNCT', 'VERB', 'ADV', 'DET', 'NOUN', 'DET', 'ADV', 'ADJ', 'ADP', 'DET', 'NOUN', 'PUNCT']	0	0
Albert	675-68853114	Albert46-A3_retour_mort-vivant	675-68853114_24-135	L’histoire aurait pu être inventée pour Halloween, mais elle s’est pourtant réellement déroulée au Kazakhstan. 	doltean_1617172722099_675-68853114	doltean	L’histoire aurait pu être inventée pour Halloween	Proposition	L'histoire aurait pu être inventée pour Halloween	Montree	Base	Aucun	Surprise	Aucune	le histoire avoir pouvoir être inventer pour Halloween	l’ histoire avoir pouvoir être inventer pour Halloween	0	0	0	0	['DET', 'NOUN', 'AUX', 'VERB', 'AUX', 'VERB', 'ADP', 'PROPN', 'PUNCT', 'CCONJ', 'PRON', 'PRON', 'AUX', 'ADV', 'ADV', 'VERB', 'ADP', 'DET', 'PROPN', 'PUNCT']	0	0
Albert	3068-12408759	Albert46-A3_science_fait_remarcher_handicapes	3068-12408759_230-405	Cela pourrait tenir du miracle religieux, mais c’est bien une prouesse accomplie par la science qui a été révélée dans le magazine scientifique Nature, le 31 octobre dernier. 	doltean_1617172915981_3068-12408759	doltean	Cela pourrait tenir du miracle religieux	Proposition	Cela pourrait tenir du miracle religieux	Montree	Base	Aucun	Surprise	Aucune	celer pouvoir tenir de miracle religieux	celer pouvoir tenir de miracle religieux	0	0	0	0	['PRON', 'VERB', 'VERB', 'ADP', 'DET', 'NOUN', 'ADJ', 'PUNCT', 'CCONJ', 'PRON', 'AUX', 'ADV', 'DET', 'NOUN', 'VERB', 'ADP', 'DET', 'NOUN', 'PRON', 'AUX', 'AUX', 'VERB', 'ADP', 'DET', 'NOUN', 'ADJ', 'PROPN', 'PUNCT', 'DET', 'NUM', 'NOUN', 'ADJ', 'PUNCT']	0	0
Albert	2950-51094890	Albert48-science_prouve_licornes	2950-51094890_456-728	Surnommé « licorne », l’Elasmotherium sibiricum n’a pourtant rien de la créature légendaire proche d’un élégant cheval : mesurant environ 2 mètres de haut pour 4 mètres de long et pesant aux alentours de 4 tonnes, cet animal préhistorique était plus proche du rhinocéros. 	doltean_1620398591476_2950-51094890	doltean	n’a pourtant rien de	Proposition	n'a rien de	Montree	Base	Aucun	Surprise	Aucune	ne avoir rien de	n’ avoir pourtant rien de	0	0	0	0	['VERB', 'PUNCT', 'NOUN', 'PUNCT', 'PUNCT', 'DET', 'PROPN', 'X', 'ADV', 'VERB', 'ADV', 'PRON', 'ADP', 'DET', 'NOUN', 'ADJ', 'ADJ', 'ADP', 'DET', 'ADJ', 'NOUN', 'PUNCT', 'VERB', 'ADV', 'NUM', 'NOUN', 'ADP', 'NOUN', 'ADP', 'NUM', 'NOUN', 'ADP', 'NOUN', 'CCONJ', 'VERB', 'ADP', 'DET', 'NOUN', 'ADP', 'NUM', 'NOUN', 'PUNCT', 'DET', 'NOUN', 'ADJ', 'AUX', 'ADV', 'ADJ', 'ADP', 'DET', 'NOUN', 'PUNCT']	0	0
Albert	2925-14598540	Albert58-A3_20000_lieues_sous_terre	2925-14598540_571-743	La proposition de certains experts tient ainsi du scénario de science-fiction, mais elle est pourtant très sérieuse : la solution se trouverait en effet... sous nos pieds !	doltean_1620723297829_2925-14598540	doltean	tient du scénario de science-fiction	Proposition	tient du scénario de science-fiction	Montree	Base	Aucun	Surprise	Aucune	tient de scénario de science - fiction	tient de scénario de science - fiction	0	1	0	0	['DET', 'NOUN', 'ADP', 'DET', 'NOUN', 'VERB', 'ADV', 'ADP', 'DET', 'NOUN', 'ADP', 'NOUN', 'PUNCT', 'CCONJ', 'PRON', 'AUX', 'ADV', 'ADV', 'ADJ', 'PUNCT', 'DET', 'NOUN', 'PRON', 'VERB', 'ADP', 'NOUN', 'PUNCT', 'ADP', 'DET', 'NOUN', 'PUNCT']	0	0
Albert	558-21167883	Albert60-A3_Tout_ce_qui_brille	558-21167883_19-173	Il est rare que l’argent tombe du ciel et pourtant, il y a une quinzaine de jours, un jardinier du Château de Versailles a vécu cette drôle d’expérience. 	doltean_1620814047956_558-21167883	doltean	Il est rare que l’argent tombe du ciel et pourtant	Proposition	Il est rare que l’argent tombe du ciel et pourtant	Montree	Base	Aucun	Surprise	Aucune	il être rare que l’ argent tombe de ciel et pourtant	il être rare que l’ argent tombe de ciel et pourtant	0	0	0	0	['PRON', 'AUX', 'ADJ', 'SCONJ', 'DET', 'NOUN', 'VERB', 'ADP', 'DET', 'NOUN', 'CCONJ', 'ADV', 'PUNCT', 'PRON', 'PRON', 'VERB', 'DET', 'NOUN', 'ADP', 'NOUN', 'PUNCT', 'DET', 'NOUN', 'ADP', 'DET', 'NOUN', 'ADP', 'PROPN', 'AUX', 'VERB', 'DET', 'NOUN', 'ADP', 'NOUN', 'PUNCT']	0	0
Albert	2907-63503649	Albert64-A3_Greta_Thunberg	2907-63503649_1087-1365	Le 24 septembre, elle s’est même rendue à l’ONU (l’Organisation des Nations Unies), où elle a prononcé un discours véhément. « Des écosystèmes entiers s’effondrent, nous sommes au début d’une extinction de masse et tout ce dont vous parlez c’est d’argent », leur a-t-elle lancé.	doltean_1621511131517_2907-63503649	doltean	tout ce dont vous parlez c’est d’argent	Proposition	tout ce dont vous parlez c'est d'argent	Montree	Base	Aucun	Colere	Aucune	tout ce dont vous parler ce être de argent	tout ce dont vous parler c’ être d’ arger	0	0	0	0	['DET', 'NUM', 'NOUN', 'PUNCT', 'PRON', 'PRON', 'AUX', 'ADV', 'VERB', 'ADP', 'DET', 'PROPN', 'PUNCT', 'DET', 'NOUN', 'ADP', 'DET', 'NOUN', 'ADJ', 'PUNCT', 'PUNCT', 'PRON', 'PRON', 'AUX', 'VERB', 'DET', 'NOUN', 'ADJ', 'PUNCT', 'PUNCT', 'DET', 'NOUN', 'ADJ', 'PRON', 'VERB', 'PUNCT', 'PRON', 'VERB', 'ADP', 'DET', 'NOUN', 'ADP', 'DET', 'NOUN', 'ADP', 'NOUN', 'CCONJ', 'ADJ', 'PRON', 'PRON', 'PRON', 'VERB', 'PRON', 'AUX', 'ADP', 'NOUN', 'PUNCT', 'PUNCT', 'PRON', 'AUX', 'PRON', 'VERB', 'PUNCT']	0	0
Albert	2860-35766423	Albert78-A3_pole_Sud_foret_tropicale	2860-35766423_224-391	Difficile d’imaginer qu’il y a environ 90 millions d’années, à la place d’une banquise peuplée de manchots se dressait une forêt tropicale à la végétation luxuriante. 	doltean_1621266552461_2860-35766423	doltean	Difficile d’imaginer	Proposition	Difficile d'imaginer	Montree	Base	Aucun	Surprise	Aucune	difficile de imaginer	difficile d’ imaginer	0	0	0	0	['ADJ', 'ADP', 'VERB', 'SCONJ', 'PRON', 'PRON', 'VERB', 'ADV', 'NUM', 'NOUN', 'ADP', 'NOUN', 'PUNCT', 'ADP', 'DET', 'NOUN', 'ADP', 'DET', 'NOUN', 'VERB', 'ADP', 'NOUN', 'PRON', 'VERB', 'DET', 'NOUN', 'ADJ', 'ADP', 'DET', 'NOUN', 'ADJ', 'PUNCT']	0	0
CovidJeunesse	1884-0	covid_10-13_MonQuotidienTemoignages_savon-toilettes	1884-0_1383-1479	"Aurélien trouve cela injuste : ""Ce n'est pas aux familles d'acheter ces produits pour l'école"". "	doltean_1618820178866_1884-0	doltean	Ce n'est pas aux familles d'acheter ces produits pour l'école	Proposition	"ce n'est pas aux familles d'acheter ces produits pour l""école"	Montree	Base	Aucun	Colere	Aucune	"ce ne être pas à famille de acheter ce produit pour l""école"	ce ne être pas à famille de acheter ce produit pour le école	0	0	0	0	['PROPN', 'VERB', 'PRON', 'ADJ', 'PUNCT', 'PUNCT', 'PRON', 'ADV', 'AUX', 'ADV', 'ADP', 'DET', 'NOUN', 'ADP', 'VERB', 'DET', 'NOUN', 'ADP', 'DET', 'NOUN', 'PUNCT', 'PUNCT']	0	0
CovidJeunesse	1833-29197080	covid_8-13_PtitLibeTemoignages_Jiashu	1833-29197080_1701-1731	Ils sont vraiment courageux !»	doltean_1621430457787_1833-29197080	doltean	Ils sont vraiment courageux	Proposition	courageux	Montree	Complexe	Aucun	Admiration	Aucune	courageux	il être vraiment courageux	0	1	0	0	['PRON', 'AUX', 'ADV', 'ADJ', 'PUNCT', 'PUNCT']	0	0
FictionProjetM2	40736-38686131	Desarthe_Frrrintek	40736-38686131_1073-1109	- Qu'est-ce qui t'arrive, Grondouk ?	yoleneconstable_1618505372660_40736-38686131	yoleneconstable	Qu'est-ce qui t'arrive, Grondouk ?	Proposition	Qu'est-ce qui t'arrive ; ?	Montree	Base	Aucun	Surprise	Aucune	que être -ce qui te arriver ; ?	que être -ce qui te arriver , Grondouk ?	0	0	1	1	['PUNCT', 'PRON', 'AUX', 'PRON', 'PRON', 'PRON', 'VERB', 'PUNCT', 'PROPN', 'PUNCT']	0	0
FictionProjetM2	40736-38686131	Desarthe_Frrrintek	40736-38686131_3694-3741	Parce que, comme je te l'ai dit, je sais TOUT !	yoleneconstable_1618583580994_40736-38686131	yoleneconstable	sais TOUT	Proposition	TOUT	Montree	Complexe	Aucun	Fierte	Aucune	tout	savoir tout	0	1	0	0	['ADV', 'SCONJ', 'PUNCT', 'SCONJ', 'PRON', 'PRON', 'PRON', 'AUX', 'VERB', 'PUNCT', 'PRON', 'VERB', 'NOUN', 'PUNCT']	0	0
FictionProjetM2	40736-38686131	Desarthe_Frrrintek	40736-38686131_7491-7576	- Qui est Frrrintek? a demandé ma mère qui n'est pas au courant pour nos noms inuits.	yoleneconstable_1618519614082_40736-38686131	yoleneconstable	Qui est Frrrintek?	Proposition	Qui ; ?	Montree	Base	Aucun	Surprise	Aucune	qui ; ?	qui être frrrintek ?	0	0	1	1	['PUNCT', 'PRON', 'AUX', 'PROPN', 'PUNCT', 'AUX', 'VERB', 'DET', 'NOUN', 'PRON', 'ADV', 'VERB', 'ADV', 'ADP', 'DET', 'NOUN', 'ADP', 'DET', 'NOUN', 'ADJ', 'PUNCT']	0	0
FictionProjetM2	40736-38686131	Desarthe_Frrrintek	40736-38686131_10679-10715	- Qu'est-ce qui t'arrive, Grondouk ?	yoleneconstable_1618521213280_40736-38686131	yoleneconstable	Qu'est-ce qui t'arrive, Grondouk ?	Proposition	Qu'est-ce qui t'arrive ; ?	Montree	Base	Aucun	Surprise	Aucune	que être -ce qui te arriver ; ?	que être -ce qui te arriver , Grondouk ?	0	0	1	1	['PUNCT', 'PRON', 'AUX', 'PRON', 'PRON', 'PRON', 'VERB', 'PUNCT', 'PROPN', 'PUNCT']	0	0
FictionProjetM2	40736-38686131	Desarthe_Frrrintek	40736-38686131_11503-11519	C’est horrible. 	yoleneconstable_1618521630510_40736-38686131	yoleneconstable	C’est horrible	Proposition	horrible	Montree	Base	Base	Peur	Tristesse	horrible	c’ être horrible	0	0	0	0	['PRON', 'AUX', 'ADJ', 'PUNCT']	0	0
FictionProjetM2	40736-38686131	Desarthe_Frrrintek	40736-38686131_18398-18442	- C'est très bien, Orlando, m'a-t-elle dit. 	yoleneconstable_1618524323016_40736-38686131	yoleneconstable	C'est très bien, Orlando	Proposition	C'est très bien	Montree	Complexe	Aucun	Fierte	Aucune	ce être très bien	ce être très bien , Orlando	0	0	0	0	['PUNCT', 'PRON', 'AUX', 'ADV', 'ADV', 'PUNCT', 'PROPN', 'PUNCT', 'PRON', 'AUX', 'PRON', 'VERB', 'PUNCT']	0	0
FictionProjetM2	40736-38686131	Desarthe_Frrrintek	40736-38686131_18442-18464	Tu es un bon camarade.	yoleneconstable_1618524328044_40736-38686131	yoleneconstable	Tu es un bon camarade	Proposition	bon camarade	Montree	Complexe	Aucun	Fierte	Aucune	bon camarade	taire être un bon camarade	0	0	0	0	['PRON', 'AUX', 'DET', 'ADJ', 'NOUN', 'PUNCT']	0	0
FictionProjetM2	40736-38686131	Desarthe_Frrrintek	40736-38686131_19681-19760	- Pourquoi les gens ne veulent pas savoir la vérité ? j'ai demandé à Frrrintek.	yoleneconstable_1618590866619_40736-38686131	yoleneconstable	Pourquoi les gens ne veulent pas savoir la vérité ?	Proposition	Pourquoi ; ?	Montree	Base	Aucun	Tristesse	Aucune	pourquoi ; ?	pourquoi le gens ne vouloir pas savoir le vérité ?	0	0	1	1	['PUNCT', 'ADV', 'DET', 'NOUN', 'ADV', 'VERB', 'ADV', 'VERB', 'DET', 'NOUN', 'PUNCT', 'PRON', 'AUX', 'VERB', 'ADP', 'PROPN', 'PUNCT']	0	0
FictionProjetM2	40736-38686131	Desarthe_Frrrintek	40736-38686131_20497-20527	- Et c'est grave, Frrrintek ? 	yoleneconstable_1618525027638_40736-38686131	yoleneconstable	Et c'est grave,	Proposition	grave	Montree	Base	Aucun	Peur	Aucune	grave	et ce être grave ,	0	0	0	1	['PUNCT', 'CCONJ', 'PRON', 'AUX', 'ADJ', 'PUNCT', 'PROPN', 'PUNCT']	0	0
FictionProjetM2	40736-38686131	Desarthe_Frrrintek	40736-38686131_23572-23663	Quand je leur ai demandé “Mais qu'est-ce qu'il a Frrrintek ?” Ils n'ont pas su me répondre.	yoleneconstable_1620320507587_40736-38686131	yoleneconstable	Mais qu'est-ce qu'il a Frrrintek ?	Proposition	Mais qu'est-ce qu'il a Frrrintek ?	Montree	Base	Base	Peur	Tristesse	mais que être -ce que il avoir Frrrintek ?	mais que être -ce que il avoir Frrrintek ?	0	0	1	1	['SCONJ', 'PRON', 'PRON', 'AUX', 'VERB', 'PUNCT', 'CCONJ', 'PRON', 'AUX', 'PRON', 'SCONJ', 'PRON', 'VERB', 'PROPN', 'PUNCT', 'PUNCT', 'PRON', 'ADV', 'AUX', 'ADV', 'VERB', 'PRON', 'VERB', 'PUNCT']	0	0
FictionProjetM2	40736-38686131	Desarthe_Frrrintek	40736-38686131_23663-23718	- Frrrintek ? a dit François, qui c'est ça, Frrrintek ?	yoleneconstable_1618526244680_40736-38686131	yoleneconstable	qui c'est ça, Frrrintek ?	Proposition	qui c'est ça, Frrrintek ?	Montree	Base	Aucun	Surprise	Aucune	qui ce être çer , Frrrintek ?	qui ce être çer , Frrrintek ?	0	0	1	1	['PUNCT', 'PROPN', 'PUNCT', 'AUX', 'VERB', 'PROPN', 'PUNCT', 'PRON', 'PRON', 'AUX', 'PRON', 'PUNCT', 'PROPN', 'PUNCT']	0	0
FictionProjetM2	40736-38686131	Desarthe_Frrrintek	40736-38686131_23663-23718	- Frrrintek ? a dit François, qui c'est ça, Frrrintek ?	yoleneconstable_1618526241482_40736-38686131	yoleneconstable	Frrrintek ?	Proposition	Frrrintek ?	Montree	Base	Aucun	Surprise	Aucune	Frrrintek ?	Frrrintek ?	0	0	1	1	['PUNCT', 'PROPN', 'PUNCT', 'AUX', 'VERB', 'PROPN', 'PUNCT', 'PRON', 'PRON', 'AUX', 'PRON', 'PUNCT', 'PROPN', 'PUNCT']	0	0
FictionProjetM2	40736-38686131	Desarthe_Frrrintek	40736-38686131_23718-23740	- Je veux dire Jasper.	yoleneconstable_1620321290054_40736-38686131	yoleneconstable	 Je veux dire Jasper.	Proposition	Je veux dire	Montree	Complexe	Aucun	Embarras	Aucune	je vouloir dire	  je vouloir dire jasper .	0	0	0	0	['PUNCT', 'PRON', 'VERB', 'VERB', 'PROPN', 'PUNCT']	0	0
FictionProjetM2	40736-38686131	Desarthe_Frrrintek	40736-38686131_23874-23891	- Il est malade ?	yoleneconstable_1620322148224_40736-38686131	yoleneconstable	Il est malade ?	Proposition	malade ; ?	Montree	Base	Aucun	Peur	Aucune	malade ; ?	il être malade ?	0	0	1	1	['PUNCT', 'PRON', 'AUX', 'ADJ', 'PUNCT']	0	0
FictionProjetM2	40736-38686131	Desarthe_Frrrintek	40736-38686131_23944-23971	- Il va mourir, c'est ça ? 	yoleneconstable_1620323053021_40736-38686131	yoleneconstable	Il va mourir, c'est ça ?	Proposition	mourir ; c'est ça	Montree	Base	Base	Peur	Tristesse	mourir ; ce être çer	il aller mourir , ce être cela ?	0	0	1	1	['PUNCT', 'PRON', 'VERB', 'VERB', 'PUNCT', 'PRON', 'AUX', 'PRON', 'PUNCT']	0	0
FictionProjetM2	40736-38686131	Desarthe_Frrrintek	40736-38686131_24280-24574	Il paraît qu'on peut aussi être fou de joie, mais Marianne et François, même s'ils sont parfois cruels, même s'il leur arrive de dire, “Mais qu'est-ce qu'on a fait au bon dieu pour avoir des monstres pareils ?” ne sont quand même pas assez méchants pour rire de la maladie mortelle d'un enfant.	yoleneconstable_1620325026926_40736-38686131	yoleneconstable	“Mais qu'est-ce qu'on a fait au bon dieu pour avoir des monstres pareils ?”	Proposition	Mais ; monstres	Montree	Base	Base	Colere	Tristesse	mais ; monstre	“ mais que être -ce que on avoir faire au bon dieu pour avoir un monstre pareil ? ”	0	0	1	1	['PRON', 'VERB', 'SCONJ', 'PRON', 'VERB', 'ADV', 'AUX', 'ADJ', 'ADP', 'NOUN', 'PUNCT', 'CCONJ', 'PROPN', 'CCONJ', 'PROPN', 'PUNCT', 'ADV', 'SCONJ', 'PRON', 'AUX', 'ADV', 'ADJ', 'PUNCT', 'ADV', 'SCONJ', 'PRON', 'PRON', 'VERB', 'ADP', 'VERB', 'PUNCT', 'PUNCT', 'CCONJ', 'PRON', 'AUX', 'PRON', 'PRON', 'PRON', 'AUX', 'VERB', 'ADP', 'DET', 'ADJ', 'NOUN', 'ADP', 'VERB', 'DET', 'NOUN', 'ADJ', 'PUNCT', 'PUNCT', 'ADV', 'AUX', 'ADV', 'ADV', 'ADV', 'ADV', 'ADJ', 'ADP', 'VERB', 'ADP', 'DET', 'NOUN', 'ADJ', 'ADP', 'DET', 'NOUN', 'PUNCT']	0	0
FictionProjetM2	40736-38686131	Desarthe_Frrrintek	40736-38686131_24772-24798	Frrrintek, tu m'entends ? 	yoleneconstable_1620325533771_40736-38686131	yoleneconstable	Frrrintek, tu m'entends ?	Proposition	tu m'entends ?	Montree	Base	Aucun	Peur	Aucune	tu me entendre ?	Frrrintek , tu me entendre ?	0	0	1	1	['PROPN', 'PUNCT', 'PRON', 'PRON', 'VERB', 'PUNCT']	0	0
FictionProjetM2	40736-38686131	Desarthe_Frrrintek	40736-38686131_24798-24820	Qu'est-ce que tu as ? 	yoleneconstable_1620325574359_40736-38686131	yoleneconstable	Qu'est-ce que tu as ?	Proposition	Qu'est-ce que tu as ?	Montree	Base	Aucun	Peur	Aucune	que être -ce que tu as ?	que être -ce que tu as ?	0	0	1	1	['PRON', 'AUX', 'PRON', 'PRON', 'PRON', 'VERB', 'PUNCT']	0	0
FictionProjetM2	40736-38686131	Desarthe_Frrrintek	40736-38686131_24820-24853	Papa et maman sont devenus fous. 	yoleneconstable_1620325587714_40736-38686131	yoleneconstable	Papa et maman sont devenus fous	Proposition	sont devenus fous	Montree	Base	Aucun	Peur	Aucune	être devenir fou	Papa et maman être devenir fou	0	0	0	0	['NOUN', 'CCONJ', 'NOUN', 'AUX', 'VERB', 'ADJ', 'PUNCT']	0	0
FictionProjetM2	40736-38686131	Desarthe_Frrrintek	40736-38686131_25029-25055	Raconte-moi une histoire. 	yoleneconstable_1620584667519_40736-38686131	yoleneconstable	Raconte-moi une histoire	Proposition	Raconte-moi	Montree	Base	Aucun	Peur	Aucune	Raconte moi	Raconte moi un histoire	0	0	0	0	['VERB', 'PRON', 'DET', 'NOUN', 'PUNCT']	0	0
FictionProjetM2	40736-38686131	Desarthe_Frrrintek	40736-38686131_25055-25144	Je vais aller me mettre dans mon lit et on va faire comme si c'était la nuit, d'accord ? 	yoleneconstable_1620584718051_40736-38686131	yoleneconstable	Je vais aller me mettre dans mon lit et on va faire comme si c'était la nuit, d'accord ?	Proposition	d'accord ?	Montree	Base	Aucun	Peur	Aucune	de accord ?	je aller aller me mettre dans mon lit et on aller faire comme si ce être le nuit , de accord ?	0	0	1	1	['PRON', 'VERB', 'VERB', 'PRON', 'VERB', 'ADP', 'DET', 'NOUN', 'CCONJ', 'PRON', 'VERB', 'VERB', 'SCONJ', 'SCONJ', 'PRON', 'AUX', 'DET', 'NOUN', 'PUNCT', 'ADP', 'NOUN', 'PUNCT']	0	0
FictionProjetM2	40736-38686131	Desarthe_Frrrintek	40736-38686131_25388-25414	- Tu as mal quelque part ?	yoleneconstable_1620585760657_40736-38686131	yoleneconstable	Tu as mal quelque part ?	Proposition	mal quelque part ?	Montree	Base	Aucun	Peur	Aucune	mal quelque part ?	tu as mal quelque part ?	0	0	1	1	['PUNCT', 'PRON', 'VERB', 'ADV', 'DET', 'NOUN', 'PUNCT']	0	0
FictionProjetM2	40736-38686131	Desarthe_Frrrintek	40736-38686131_25429-25440	- Tu dors ?	yoleneconstable_1620585783405_40736-38686131	yoleneconstable	Tu dors ?	Proposition	Tu dors ?	Montree	Base	Aucun	Peur	Aucune	tu dormir ?	tu dormir ?	0	0	1	1	['PUNCT', 'PRON', 'VERB', 'PUNCT']	0	0
FictionProjetM2	40736-38686131	Desarthe_Frrrintek	40736-38686131_28925-28956	C'était ça l'indice, le signe. 	yoleneconstable_1620590520218_40736-38686131	yoleneconstable	C'était ça l'indice, le signe.	Proposition	C'était ça l'indice, le signe	Montree	Base	Aucun	Joie	Aucune	ce être cela le indice , le signe	ce être cela le indice , le signe .	0	0	0	0	['PRON', 'AUX', 'PRON', 'DET', 'NOUN', 'PUNCT', 'DET', 'NOUN', 'PUNCT']	0	0
FictionProjetM2	40736-38686131	Desarthe_Frrrintek	40736-38686131_29060-29083	J'ai trouvé la lettre. 	yoleneconstable_1620591566980_40736-38686131	yoleneconstable	ai trouvé la lettre	Proposition	trouvé ta lettre	Montree	Base	Aucun	Joie	Aucune	trouver ton lettre	avoir trouver le lettre	0	0	0	0	['PRON', 'AUX', 'VERB', 'DET', 'NOUN', 'PUNCT']	0	0
